group_col,group_value,topic_cluster,topic_size,keywords
docform_cluster,c0004_r0004,3,36,"trump, donald, donald trump, michael, mr, states, new, paul, washington, krassner, phone, committee, mr trump, paul krassner, select"
docform_cluster,c0004_r0004,5,15,"virgin, islands, virgin islands, epstein, daily news, miami, islands daily, case, daily, news, prosecutors, deal, federal, attorney, acosta"
docform_cluster,c0004_r0004,1,14,"epstein, jeffrey, jeffrey epstein, ghislaine, maxwell, wikipedia, york, ghislaine maxwell, book, prince, new, en wikipedia, new york, en, prince andrew"
docform_cluster,c0004_r0004,4,14,"bannon, question, world, steve, make, epstein jeevacation, internet, steve bannon, right, jeevacation, facebook, jeffrey, coming, social, prime"
docform_cluster,c0004_r0004,0,11,"dershowitz, alan, alan dershowitz, sex, epstein, underage, island, woman, lawyer, roberts, jeffrey epstein, accusers, jeffrey, accuse, false accusers"
docform_cluster,c0004_r0004,2,11,"event, great, don, press, paris, girls, believe, come, know, happy, girl, fun, andrew, ibiza, tigrane"
docform_cluster,c0004_r0004,6,11,"beach, palm, palm beach, perversion, police, perversion justice, epstein, continued, perversion continued, town, justice, islands, told, islands daily, virgin islands"
